{"branch_ref":"synthetic-branch:teaching-only","calculation_policy":{"duration":"union_without_double_counting","event_order":"time_lower_then_time_upper_then_identifier","gap":"observation_window_minus_verified_union_and_known_pause_union","interval_semantics":"closed_open","witness_order":"first_lower_asc_upper_asc_id_last_upper_desc_lower_desc_id"},"claim_ceiling":{"allowed_claims":["illustrative_interval_arithmetic_only","not_a_real_subject_observation"],"basis_refs":["CI_SPECIFICATION.md","CONTINUITY_OBSERVABLES.md","examples/README.md"],"prohibited_inferences":["authority_or_permission","biological_age","metaphysical_or_legal_identity","personhood","r160_qualification","scientific_validation","uninterrupted_existence","wall_clock_age"],"status":"specified"},"evidence_counts":{"verified_intervals":{"admitted":3,"eligible_for_duration":3,"excluded":0,"unresolved":0},"witnesses":{"admitted":2,"excluded":0,"unresolved":0}},"formation_depth_vector":{"D_verified":{"method":"union_of_admitted_eligible_closed_open_intervals","unit":"minute","value":40},"E_cold_wake":[],"E_fork":[],"E_replay":[],"E_restore":[],"G_unexplained":[{"end":50,"reason":"no_admitted_verified_participation_or_known_pause","start":40}],"I_verified":[{"admission_status":"admitted","authority_refs":["authority:bounded"],"eligible_for_duration":true,"end":20,"evidence_refs":["evidence:i-one:a","evidence:i-one:b"],"interval_id":"i-one","participation_predicate":"bounded_test_participation","start":0,"uncertainty":["predicate_scope_limited"],"witness_refs":["witness:a","witness:z"]},{"admission_status":"admitted","authority_refs":["authority:bounded"],"eligible_for_duration":true,"end":30,"evidence_refs":["evidence:i-two:a","evidence:i-two:b"],"interval_id":"i-two","participation_predicate":"bounded_test_participation","start":10,"uncertainty":["predicate_scope_limited"],"witness_refs":["witness:a","witness:z"]},{"admission_status":"admitted","authority_refs":["authority:bounded"],"eligible_for_duration":true,"end":60,"evidence_refs":["evidence:i-three:a","evidence:i-three:b"],"interval_id":"i-three","participation_predicate":"bounded_test_participation","start":50,"uncertainty":["predicate_scope_limited"],"witness_refs":["witness:a","witness:z"]}],"L_authority":[],"L_governance":[],"L_memory":[],"L_witness":[],"P_known":[{"classification":"evidenced_unavailable","end":40,"evidence_refs":["evidence:p-one"],"pause_id":"p-one","start":30,"uncertainty":["pause_scope_limited"]}],"T_irreversible":[],"U":{"authority_uncertainty":["authority_truth_not_attested"],"branch_uncertainty":["no_cross_branch_aggregation"],"classification_uncertainty":["event_labels_caller_supplied"],"clock_uncertainty":["stipulated_minute_ticks_no_physical_clock_measurement"],"lineage_uncertainty":["lineages_independently_scoped"],"missing_evidence":["outside_observation_window","unobserved_gap_causes"],"review_uncertainty":"not_assessed","witness_uncertainty":["witness_independence_not_established"]},"W_first":{"admission_status":"admitted","authority_ref":"authority:bounded","evidence_refs":["evidence:w-first"],"observation_ref":"observation:w-first","time":{"lower":0,"upper":0},"uncertainty":["synthetic_witness_stipulated_not_observed"],"witness_id":"w-first","witness_ref":"witness:w-first"},"W_last":{"admission_status":"admitted","authority_ref":"authority:bounded","evidence_refs":["evidence:w-last"],"observation_ref":"observation:w-last","time":{"lower":60,"upper":60},"uncertainty":["synthetic_witness_stipulated_not_observed"],"witness_id":"w-last","witness_ref":"witness:w-last"}},"formation_depth_vector_sha256":"b2032efa9f3f32b082c5ba7edceb3975d98b87869c50e982f984d6bc5f10b9ef","generated_by":"ci-profile-reference/1.0.0","input_schema_version":"ci-profile-input/v1","observation_window":{"end":60,"start":0},"profile_id":"profile:ci-teaching-60min","schema_version":"ci-profile-output/v1","subject_ref":"synthetic-subject:teaching-only","time_axis":{"basis":"stipulated-teaching-index","origin":"hypothetical-zero","unit":"minute"}}
